"Component","Tags","Link","File"
"Android Notification","Android, адроид, notification, уведомление, android, андроид, alert, алерт, message, сообщение, popup, всплывашка, badge, бейдж, reminder, напоминание, push, пуш, event, событие, attention, внимание, status, статус, system, системный","https://www.figma.com/file/7V4UQ61IVRxGArYZ20n7MH?node-id=3253%3A24","App Components"
"Button 2.0","main, мейн, главная, button, кнопка, action, действие","https://www.figma.com/file/7V4UQ61IVRxGArYZ20n7MH?node-id=74129%3A301247","App Components"
"Icon Button Loader","button, кнопка, icon, иконка, loader, загрузка, loading, ожидание, spinner, спиннер, progress, прогресс","https://www.figma.com/file/7V4UQ61IVRxGArYZ20n7MH?node-id=255322%3A91634","App Components"
"Segmented Control Small 3","Segmented, сегментед, segmented, сегментированный, control, контрол, toggle, переключатель, switch, переключение, tab, вкладка, selector, селектор, choice, выбор, option, опция, filter, фильтр, tabs, табы, radio, радио","https://www.figma.com/file/7V4UQ61IVRxGArYZ20n7MH?node-id=176609%3A11341","App Components"
"Tabs Button","Tabs, табс, кнопка, tabs, вкладки, button, navigation, навигация, segment, сегмент, switch, переключение, group, группа","https://www.figma.com/file/7V4UQ61IVRxGArYZ20n7MH?node-id=48721%3A274158","App Components"
"Notification","notification, уведомление, alert, оповещение, indicator, индикатор, dot, точка, unread, непрочитано","https://www.figma.com/file/7V4UQ61IVRxGArYZ20n7MH?node-id=254059%3A49913","App Components"
"Button Hug w Indicator","Button, кнопка, button, counter, счетчик, count, количество, action, действие","https://www.figma.com/file/7V4UQ61IVRxGArYZ20n7MH?node-id=253709%3A3657","App Components"
"Button Loader","Button, кнопка, button, loader, загрузка, loading, ожидание, spinner, спиннер, wait","https://www.figma.com/file/7V4UQ61IVRxGArYZ20n7MH?node-id=75302%3A302366","App Components"
"Android Keyboard","keyboard, клавиатура, android, андроид, input, ввод, type, печатать, mobile, мобильный, layout, раскладка, system, системный, клава","https://www.figma.com/file/7V4UQ61IVRxGArYZ20n7MH?node-id=3251%3A664","App Components"
"Navbar 2.0 No Title/Lite","Navbar, нав, nav, navbar, навбар, navigation, навигация, menu, меню, header, шапка, top, верх, bar, панель","https://www.figma.com/file/7V4UQ61IVRxGArYZ20n7MH?node-id=152868%3A162606","App Components"
"Modal Card Graphic 2.0","модалка, графика, иллюстрация, modal, модальное, card, карточка, graphic, illustration, image, изображение, visual, визуал, popup, всплывашка, message, сообщение, promo, промо, notification, уведомление","https://www.figma.com/file/7V4UQ61IVRxGArYZ20n7MH?node-id=76055%3A304568","App Components"
"Modal Page 2.0","Modal, модалка, modal, модальное, overlay, оверлей, popup, всплывашка, attention, внимание, dialog, диалог","https://www.figma.com/file/7V4UQ61IVRxGArYZ20n7MH?node-id=107604%3A327019","App Components"
"Secondary Banner 2.0","Secondary, секондари, вторичный, banner, баннер, info, информация, notice, уведомление, feature, фича, news, новости, message, сообщение, secondary, card, карточка","https://www.figma.com/file/7V4UQ61IVRxGArYZ20n7MH?node-id=107604%3A648494","App Components"
"Navbar 2.0 Title Action/Complete","navbar, навбар, navigation, навигация, menu, меню, header, шапка, top, верх, bar, панель, tabs, табы","https://www.figma.com/file/7V4UQ61IVRxGArYZ20n7MH?node-id=152868%3A162685","App Components"
"Navbar 2.0 Center Title/Lite","Navbar, нав, nav, navbar, навбар, navigation, навигация, menu, меню, header, шапка, top, верх, bar, панель","https://www.figma.com/file/7V4UQ61IVRxGArYZ20n7MH?node-id=152868%3A162618","App Components"
"Scroll Down Button","Scroll, скролл, scrolldown, прокруткавниз, button, кнопка, arrow, стрелка, bottom, низ, navigation, навигация, action, действие, chat, чат, message, сообщение","https://www.figma.com/file/7V4UQ61IVRxGArYZ20n7MH?node-id=150543%3A10083","App Components"
"Navbar 2.0 Large Title/Complete","Navbar, нав, nav, navbar, навбар, navigation, навигация, menu, меню, header, шапка, top, верх, bar, панель, tabs, табы","https://www.figma.com/file/7V4UQ61IVRxGArYZ20n7MH?node-id=152868%3A162638","App Components"
"Button Fill w Counter","Button, кнопка, button, counter, счетчик, count, количество, action, действие","https://www.figma.com/file/7V4UQ61IVRxGArYZ20n7MH?node-id=253446%3A21394","App Components"
"Modal Select 2.0","Modal, модалка, modal, модальное, select, выбор, picker, селектор, option, опция, multiselect, множественныйвыбор, uniselect, одиночныйвыбор, list, список, form, форма, choice, interactive, интерактив, dropdown, выпадающийсписок, search, поиск","https://www.figma.com/file/7V4UQ61IVRxGArYZ20n7MH?node-id=119907%3A511913","App Components"
"Choice Chip Menu w Graphic","Choice, чип, chip, choice, выбор, toggle, переключатель, radio, радио, selector, селектор, option, опция, filter, фильтр","https://www.figma.com/file/7V4UQ61IVRxGArYZ20n7MH?node-id=197255%3A8830","App Components"
"Empty Screen w Button","Empty, пустой, экран, emptyscreen, пустойэкран, button, кнопка, action, действие, placeholder, заглушка, state, состояние, content, контент, calltoaction, призыв, illustration, иллюстрация, guide, гайд, interactive, интерактив, nocontent, нетконтента","https://www.figma.com/file/7V4UQ61IVRxGArYZ20n7MH?node-id=113392%3A319736","App Components"
"Bottom Button 2.0","Bottom, нижняя, боттом, button, кнопка, bottom, низ, fixed, фиксированный, sticky, прилипающий, action, действие","https://www.figma.com/file/7V4UQ61IVRxGArYZ20n7MH?node-id=79975%3A303938","App Components"
"Action Sheet 2.0","Action, экшен, модалка, actionsheet, шторка, menu, меню, action, действие, list, список, choice, выбор, option, опция, modal, модальное, bottom, низ","https://www.figma.com/file/7V4UQ61IVRxGArYZ20n7MH?node-id=119362%3A37430","App Components"
"Android Alert","Android, android, alert, алерт, андроид, notification, уведомление, popup, всплывашка, message, сообщение, warning, предупреждение, error, ошибка, confirm, подтверждение, action, действие, dialog, диалог, attention, внимание, system, системный","https://www.figma.com/file/7V4UQ61IVRxGArYZ20n7MH?node-id=3253%3A291","App Components"
"Success Page 2.0","Success, страница, успех, модалка, success, page, modal, модальное, confirmation, подтверждение, action, действие, feedback, фидбек, complete, завершение, positive, позитив, result, результат, done, готово","https://www.figma.com/file/7V4UQ61IVRxGArYZ20n7MH?node-id=112642%3A317420","App Components"
"Navbar 2.0 Center Title/Complete","Navbar, нав, nav, navbar, навбар, navigation, навигация, menu, меню, header, шапка, top, верх, bar, панель, tabs, табы","https://www.figma.com/file/7V4UQ61IVRxGArYZ20n7MH?node-id=152868%3A162675","App Components"
"Modal Card Background 2.0","Modal, модалка, фон, modal, модальное, card, карточка, graphic, графика, illustration, иллюстрация, image, изображение, visual, визуал, popup, всплывашка, message, сообщение, promo, промо, notification, уведомление","https://www.figma.com/file/7V4UQ61IVRxGArYZ20n7MH?node-id=76604%3A304900","App Components"
"Tertiary Banner 2.0","Tertiary, третичный, banner, баннер, info, информация, notice, уведомление, message, сообщение, tertiary, static, статичный, unclosable, незакрываемый","https://www.figma.com/file/7V4UQ61IVRxGArYZ20n7MH?node-id=107604%3A648580","App Components"
"Range 2.0.1","Range, рейндж, ползунок, slider, слайдер, range, диапазон, input, ввод, adjust, регулировка, selector, селектор","https://www.figma.com/file/7V4UQ61IVRxGArYZ20n7MH?node-id=212341%3A6401","App Components"
"Android Navigation","Android, адроид, navigation, навигация, android, андроид, bar, панель, bottom, низ, back, назад, home, домой, recent, недавние, gesture, жест, ui, интерфейс, control, управление, system, системный","https://www.figma.com/file/7V4UQ61IVRxGArYZ20n7MH?node-id=1871%3A3","App Components"
"Navbar 2.0 No Title/Complete","Navbar, нав, nav, navbar, навбар, navigation, навигация, menu, меню, header, шапка, top, верх, bar, панель, tabs, табы","https://www.figma.com/file/7V4UQ61IVRxGArYZ20n7MH?node-id=152868%3A162631","App Components"
"Avatar 2.0.1","avatar, ава, user, аватар, аватарка, юзер, profile, профиль","https://www.figma.com/file/7V4UQ61IVRxGArYZ20n7MH?node-id=186879%3A5187","App Components"
"Slider 2.0.1","Range, рейндж, ползунок, slider, слайдер, input, ввод, value, значение, adjust, регулировка, selector, селектор","https://www.figma.com/file/7V4UQ61IVRxGArYZ20n7MH?node-id=212341%3A6216","App Components"
"Modal Card 2.0","Modal, модал, модалка, modal, модальное, card, карточка, dialog, диалог, popup, всплывашка, alert, оповещение, interrupt, прерывание, action, действие, attention, внимание","https://www.figma.com/file/7V4UQ61IVRxGArYZ20n7MH?node-id=76047%3A305085","App Components"
"Primary Banner 2.0","primay, праймари, главный, banner, баннер, info, информация, notice, feature, фича, news, новости, alert, оповещение","https://www.figma.com/file/7V4UQ61IVRxGArYZ20n7MH?node-id=107604%3A648609","App Components"
"Navbar 2.0 Large Title/Lite","Navbar, нав, nav, navbar, навбар, navigation, навигация, menu, меню, header, шапка, top, верх, bar, панель","https://www.figma.com/file/7V4UQ61IVRxGArYZ20n7MH?node-id=152868%3A162611","App Components"
"Segmented Control Small 5","Segmented, сегментед, segmented, сегментированный, control, контрол, toggle, переключатель, switch, переключение, tab, вкладка, selector, селектор, choice, выбор, option, опция, filter, фильтр, tabs, табы, radio, радио","https://www.figma.com/file/7V4UQ61IVRxGArYZ20n7MH?node-id=176609%3A11573","App Components"
"Navbar 2.0 Title Action/Lite","navbar, навбар, navigation, навигация, menu, меню, header, шапка, top, верх, bar, панель","https://www.figma.com/file/7V4UQ61IVRxGArYZ20n7MH?node-id=152868%3A162626","App Components"
"Spinner","spinner, спиннер, loading, загрузка, progress, прогресс, wait, ожидание, indicator, индикатор, process, процесс, circle, круг, animation, анимация, rotate, вращение, крутилка, preloader, прелодер","https://www.figma.com/file/7V4UQ61IVRxGArYZ20n7MH?node-id=106350%3A345413","App Components"
"Checkbox w Text","checkbox, чекбокс, text, текст, option, опция, select, выбор, form, форма, agree, согласие, confirm, подтверждение","https://www.figma.com/file/7V4UQ61IVRxGArYZ20n7MH?node-id=177215%3A13261","App Components"
"Incoming","incoming, входящие, message, сообщение, chat, чат, bubble, бабл","https://www.figma.com/file/7V4UQ61IVRxGArYZ20n7MH?node-id=14332%3A402","App Components"
"Modal Select w Search 2.0","Modal, модалка, поиск, ипнут, modal, модальное, select, выбор, picker, селектор, option, опция, multiselect, множественныйвыбор, uniselect, одиночныйвыбор, list, список, form, форма, choice, interactive, интерактив, dropdown, выпадающийсписок, чипсы, chips","https://www.figma.com/file/7V4UQ61IVRxGArYZ20n7MH?node-id=119907%3A511902","App Components"
"Pagination Dots","Pagination, точки, pagination, пагинация, dots, indicator, индикатор, navigation, навигация, slider, слайдер, swipe, свайп","https://www.figma.com/file/7V4UQ61IVRxGArYZ20n7MH?node-id=107851%3A615392","App Components"