"Component","Tags","Link","File"
"Android Status Bar","Android Status Bar, андроид статусбар, statusbar, статусбар, android, андроид, top, верх, info, информация, time, время, battery, батарея, signal, сигнал, notification, уведомление, mobile, мобильный, bar, панель, system, системный","https://www.figma.com/file/7V4UQ61IVRxGArYZ20n7MH?node-id=1324%3A1365","App Components"
"Control List","control list, контрол лист, checkbox, чекбокс, radio, радио, select, выбор, option, опция, form, форма, settings, настройки, list, список","https://www.figma.com/file/7V4UQ61IVRxGArYZ20n7MH?node-id=43837%3A258236","App Components"
"Swipeable Button","button, кнопка, swipe, свайп, unlock, разблокировка, action, действие, confirm, подтверждение, slide, сдвиг, safety, безопасность","https://www.figma.com/file/7V4UQ61IVRxGArYZ20n7MH?node-id=75306%3A301576","App Components"
"Gosuslugi Button","button, кнопка, gosuslugi, госуслуги, auth, авторизация, login, вход","https://www.figma.com/file/7V4UQ61IVRxGArYZ20n7MH?node-id=176477%3A558351","App Components"
"Icon Button","button, кнопка, icon, иконка, action, действие, tap, тап, control, управление","https://www.figma.com/file/7V4UQ61IVRxGArYZ20n7MH?node-id=255322%3A4869","App Components"
"Badge","badge, бейдж, tag, тег, label, лейбл, status, статус, mark, метка","https://www.figma.com/file/7V4UQ61IVRxGArYZ20n7MH?node-id=47499%3A424465","App Components"
"Passcode Old Code","Passcode old Code, старый код, пасс код, пин код, passcode, пароль, auth, аутентификация, security, безопасность, pin, пинкод, lock, блокировка, protection, защита, access, доступ, verification, проверка","https://www.figma.com/file/7V4UQ61IVRxGArYZ20n7MH?node-id=125563%3A4255","App Components"
"Outgoing","outgoing, исходящие, message, сообщение, chat, чат, bubble, бабл","https://www.figma.com/file/7V4UQ61IVRxGArYZ20n7MH?node-id=14332%3A177","App Components"
"Input","input, ввод, text, текст, form, форма, field, поле, type","https://www.figma.com/file/7V4UQ61IVRxGArYZ20n7MH?node-id=80898%3A476250","App Components"
"Navbar 2.0 Profile/Complete","Navbar profile, профиль, нав бар, nav bar, navbar, навбар, navigation, навигация, menu, меню, header, шапка, top, верх, bar, панель, tabs, табы, account, аккаунт","https://www.figma.com/file/7V4UQ61IVRxGArYZ20n7MH?node-id=152868%3A162660","App Components"
"Card Background","card, карточка","https://www.figma.com/file/7V4UQ61IVRxGArYZ20n7MH?node-id=3444%3A1033","App Components"
"iOS Keyboard","keyboard, клавиатура, ios, айос, input, ввод, type, печатать, mobile, мобильный, virtual, виртуальная, layout, раскладка, system, системный, клава","https://www.figma.com/file/7V4UQ61IVRxGArYZ20n7MH?node-id=3251%3A685","App Components"
"Pagination Dots Clip","Pagination Dots Clip, чип пагинации, pagination, пагинация, dots, точки, indicator, индикатор, navigation, навигация, slider, слайдер, swipe, свайп","https://www.figma.com/file/7V4UQ61IVRxGArYZ20n7MH?node-id=250546%3A9014","App Components"
"Secondary Title 2.0","Secondary Title, вторичный тайтл, h2, title, заголовок, section, секция, subheader, подзаголовок","https://www.figma.com/file/7V4UQ61IVRxGArYZ20n7MH?node-id=76647%3A297946","App Components"
"Cell","cell, ячейка, list, список, item, элемент, row, строка, table, таблица, data, данные","https://www.figma.com/file/7V4UQ61IVRxGArYZ20n7MH?node-id=41573%3A266816","App Components"
"List Checkbox","List Checkbox, лист чекбокс, checkbox, чекбокс, option, опция, select, выбор, контрол, on, off, вкл, выкл, галочка","https://www.figma.com/file/7V4UQ61IVRxGArYZ20n7MH?node-id=1462%3A42","App Components"
"Choice Chip Menu","Choice Chip Menu, чип выбора, чип меню, чип с дропдауном, chip, чип, choice, выбор, toggle, переключатель, selector, селектор, option, опция, filter, фильтр, menu, меню","https://www.figma.com/file/7V4UQ61IVRxGArYZ20n7MH?node-id=114202%3A473214","App Components"
"Cell Button Icon on Bg 2.0","button, кнопка, cell, ячейка, action, действие, tap, тап, select, выбор","https://www.figma.com/file/7V4UQ61IVRxGArYZ20n7MH?node-id=115759%3A489768","App Components"
"Separator","separator, разделитель, divider, линия, split, разделение, border, граница, line, черта","https://www.figma.com/file/7V4UQ61IVRxGArYZ20n7MH?node-id=1684%3A5","App Components"
"Primary Title 2.0","Primary Title, праймари тайтл, главный заголовок, h1, title, заголовок, header, шапка, section, секция, heading","https://www.figma.com/file/7V4UQ61IVRxGArYZ20n7MH?node-id=76647%3A297698","App Components"
"Icon Button Set Blur Large 2.0","button, кнопка, icon, иконка, group, группа, set, набор, choice, выбор, selector, селектор, blur, размытый","https://www.figma.com/file/7V4UQ61IVRxGArYZ20n7MH?node-id=116237%3A480124","App Components"
"Spacing","spacing, отступ, padding, margin, space, пространство, gap, промежуток, whitespace","https://www.figma.com/file/7V4UQ61IVRxGArYZ20n7MH?node-id=10563%3A4795","App Components"
"Switch 2.0","switch, переключатель, toggle, вкл, выкл, on, off, включение, option, опция, state, состояние, binary, двоичный","https://www.figma.com/file/7V4UQ61IVRxGArYZ20n7MH?node-id=87004%3A305968","App Components"
"iOS Notification","iOS Notification, иос нотификация, notification, уведомление, ios, айос, alert, алерт, message, сообщение, popup, всплывашка, badge, бейдж, reminder, напоминание, push, пуш, event, событие, attention, внимание, system, системный","https://www.figma.com/file/7V4UQ61IVRxGArYZ20n7MH?node-id=3253%3A85","App Components"
"Numbered List","Numbered List, намберед лист, list, список, numbered, нумерованный, ordered, порядковый, sequence, последовательность, steps, шаги, instructions, инструкции","https://www.figma.com/file/7V4UQ61IVRxGArYZ20n7MH?node-id=45565%3A421982","App Components"
"Navbar 2.0 Profile/Lite","Navbar profile, профиль, нав бар, nav bar, navbar, навбар, navigation, навигация, menu, меню, header, шапка, top, верх, bar, панель, tabs, табы, account, аккаунт","https://www.figma.com/file/7V4UQ61IVRxGArYZ20n7MH?node-id=152868%3A162648","App Components"
"Dropdown Label Inside","Dropdown Label Inside, дропдаун лейбл, дропдаун с лейблом, dropdown, выпадающийсписок, select, выбор, menu, меню, list, список, option, опция, filter, фильтр, form, форма","https://www.figma.com/file/7V4UQ61IVRxGArYZ20n7MH?node-id=80925%3A301522","App Components"
"Cell with Stepper","Cell with Stepper, ячейка со степпером, целл степпер, cell, ячейка, stepper, степпер, counter, счетчик, number, число, adjust, регулировка","https://www.figma.com/file/7V4UQ61IVRxGArYZ20n7MH?node-id=1865%3A21","App Components"
"Modal Card Data 2.0","Modal Card Data, модалка, инпут, модалка с вводом, modal, модальное, card, карточка, dialog, диалог, popup, всплывашка, alert, оповещение, interrupt, прерывание, action, действие, attention, внимание","https://www.figma.com/file/7V4UQ61IVRxGArYZ20n7MH?node-id=76608%3A305491","App Components"
"Modal Select w Chips 2.0","Modal Select w Chips, модалка, modal, модальное, select, выбор, picker, селектор, option, опция, multiselect, множественныйвыбор, uniselect, одиночныйвыбор, list, список, form, форма, choice, interactive, интерактив, dropdown, выпадающийсписок, чипсы, chips","https://www.figma.com/file/7V4UQ61IVRxGArYZ20n7MH?node-id=119907%3A511890","App Components"
"Modal Page Сustom 2.0","Modal Page Сustom, модалка кастомная, модалка, modal, модальное, overlay, оверлей, popup, всплывашка, attention, внимание, dialog, диалог","https://www.figma.com/file/7V4UQ61IVRxGArYZ20n7MH?node-id=107604%3A327561","App Components"
"Overlay","overlay, оверлей, dim, затемнение","https://www.figma.com/file/7V4UQ61IVRxGArYZ20n7MH?node-id=183379%3A49272","App Components"
"Overlay Blur","overlay, оверлей, blur, размытие, background, фон, dim, затемнение","https://www.figma.com/file/7V4UQ61IVRxGArYZ20n7MH?node-id=107604%3A542371","App Components"
"Section Description","Section Description, описание секции, description, описание, section, секция, info, информация, details, детали, caption, подпись, explanation, пояснение","https://www.figma.com/file/7V4UQ61IVRxGArYZ20n7MH?node-id=1684%3A6","App Components"
"Info","chat, чат, info, инфо, заглушка, ожидание, оператор","https://www.figma.com/file/7V4UQ61IVRxGArYZ20n7MH?node-id=14326%3A10482","App Components"
"Toast","toast, уведомление, notification, оповещение, alert, тревога, message, сообщение, popup, всплывашка, temporary, временное, feedback, фидбек, status, статус, тост","https://www.figma.com/file/7V4UQ61IVRxGArYZ20n7MH?node-id=1956%3A278","App Components"
"Modal Card Picker 2.0","Modal Card Picker, датапикер, выбор даты, модалка, modal, модальное, card, карточка, picker, выбор, date, дата, time, время, scroll, скролл, select, option, опция, list, список, wheel, барабан","https://www.figma.com/file/7V4UQ61IVRxGArYZ20n7MH?node-id=76608%3A306009","App Components"
"Calendar Plain 2.0","Calendar Plain, календарь плейн, calendar, календарь, date, дата, picker, выбор, day, день, schedule, расписание, plan, план, event, событие, select, single, одиночный","https://www.figma.com/file/7V4UQ61IVRxGArYZ20n7MH?node-id=117529%3A485776","App Components"
"Status Badge","Status badge, статус бейдж, badge, бейдж, status, статус, state, состояние, indicator, индикатор, label, лейбл","https://www.figma.com/file/7V4UQ61IVRxGArYZ20n7MH?node-id=250498%3A4526","App Components"
"iOS Status Bar","iOS Status Bar, иос статусбар, statusbar, статусбар, ios, айос, top, верх, info, информация, time, время, battery, батарея, signal, сигнал, notification, уведомление, mobile, мобильный, bar, панель, system, системный","https://www.figma.com/file/7V4UQ61IVRxGArYZ20n7MH?node-id=1324%3A1329","App Components"
"Day","chat, чат, день, day, today, сегодня","https://www.figma.com/file/7V4UQ61IVRxGArYZ20n7MH?node-id=14326%3A10484","App Components"
"Icon Button Set Blur Medium 2.0","button, кнопка, icon, иконка, group, группа, set, набор, choice, выбор, selector, селектор, blur, размытый","https://www.figma.com/file/7V4UQ61IVRxGArYZ20n7MH?node-id=116237%3A480107","App Components"
"Context Menu","Context Menu, контекстное меню, menu, меню, context, контекст, action, действие, list, список, option, опция, select, выбор, navigation, навигация","https://www.figma.com/file/7V4UQ61IVRxGArYZ20n7MH?node-id=15444%3A230687","App Components"
"Icon Button Set Alternative","button, кнопка, icon, иконка, group, группа, choice, выбор, selector, селектор, alternative, альтернативный","https://www.figma.com/file/7V4UQ61IVRxGArYZ20n7MH?node-id=116237%3A480174","App Components"
"Pagination Dots Alternative","Pagination Dots Alternative, пагинация альтернативная, пагинация другая, pagination, пагинация, dots, точки, indicator, индикатор, navigation, навигация, slider, слайдер, swipe, свайп","https://www.figma.com/file/7V4UQ61IVRxGArYZ20n7MH?node-id=250546%3A9011","App Components"
"iOS Home Indicator","iOS Home Indicator, иос хоум, иос индикатор, system, системный, ios, иос, индикатор, indicator, home, дом","https://www.figma.com/file/7V4UQ61IVRxGArYZ20n7MH?node-id=1871%3A1","App Components"
"Splash Screen My MTS 2.0","Splash Screen My MTS 2.0, сплеш скрин, splashscreen, заставка, loading, загрузка, logo, логотип, brand, бренд, mts, мтс, app, приложение, start, старт, launch, запуск","https://www.figma.com/file/7V4UQ61IVRxGArYZ20n7MH?node-id=112789%3A471624","App Components"
"Splash Screen 2.0","Splash Screen, сплеш скрин, splashscreen, заставка, loading, загрузка, logo, логотип, brand, бренд, mts, мтс, app, приложение, start, старт, launch, запуск, granat, гранат","https://www.figma.com/file/7V4UQ61IVRxGArYZ20n7MH?node-id=112789%3A471844","App Components"
"Icon Button Set Carousel 2.0 ","button, кнопка, icon, иконка, group, группа, set, набор, choice, выбор, selector, селектор, carousel, карусель","https://www.figma.com/file/7V4UQ61IVRxGArYZ20n7MH?node-id=116237%3A480028","App Components"
"Icon Button Set Medium 2.0 ","button, кнопка, icon, иконка, group, группа, set, набор, choice, выбор, selector, селектор","https://www.figma.com/file/7V4UQ61IVRxGArYZ20n7MH?node-id=116237%3A479994","App Components"
"Icon Button Set Blur Carousel 2.0","button, кнопка, icon, иконка, group, группа, set, набор, choice, выбор, selector, селектор, blur, размытый","https://www.figma.com/file/7V4UQ61IVRxGArYZ20n7MH?node-id=116237%3A480141","App Components"
"Icon Button Set Large 2.0","button, кнопка, icon, иконка, group, группа, set, набор, choice, выбор, selector, селектор","https://www.figma.com/file/7V4UQ61IVRxGArYZ20n7MH?node-id=116237%3A480011","App Components"
"Empty Screen 2.0","Empty Screen, пустой экран, emptyscreen, пустойэкран, placeholder, заглушка, state, состояние, content, контент, empty, пусто, template, шаблон, message, сообщение, illustration, иллюстрация, info, информация, guide, гайд, nocontent, нетконтента","https://www.figma.com/file/7V4UQ61IVRxGArYZ20n7MH?node-id=113392%3A319614","App Components"
"Button Price","Button Price, кнопка с ценой, прайс, баттон прайс, button, кнопка, price, цена, action, действие, cost, стоимость, purchase, покупка, buy, купить, payment, оплата, checkout, оформление","https://www.figma.com/file/7V4UQ61IVRxGArYZ20n7MH?node-id=74239%3A453124","App Components"
"Segmented Control 5","Segmented Control, сегментед контрол, segmented, сегментированный, control, контрол, toggle, переключатель, switch, переключение, tab, вкладка, selector, селектор, choice, выбор, option, опция, filter, фильтр, tabs, табы, radio, радио","https://www.figma.com/file/7V4UQ61IVRxGArYZ20n7MH?node-id=176609%3A11069","App Components"
"Button Custom","button, кнопка, action, действие, кастом","https://www.figma.com/file/7V4UQ61IVRxGArYZ20n7MH?node-id=250003%3A86719","App Components"
"Segmented Control Small 2","Segmented Control, сегментед контрол, segmented, сегментированный, control, контрол, toggle, переключатель, switch, переключение, tab, вкладка, selector, селектор, choice, выбор, option, опция, filter, фильтр, tabs, табы, radio, радио","https://www.figma.com/file/7V4UQ61IVRxGArYZ20n7MH?node-id=176609%3A11304","App Components"
"Choice Chip Uniselect","Choice Chip Uniselect, чип униселект, chip, чип, choice, выбор, toggle, переключатель, selector, селектор, option, опция, filter, фильтр, icon, иконка, emblem, эмблема, graphic, графика, custom, кастомный, multiselect, множественныйвыбор, uniselect, универсальныйвыбор, singleselect, одиночный выбор","https://www.figma.com/file/7V4UQ61IVRxGArYZ20n7MH?node-id=197255%3A7147","App Components"
"Choice Chip Multiselect Menu","Choice Chip Multiselect Menu, чип мультивыбор, чип мультиселект, chip, чип, multiselect, множественныйвыбор, toggle, переключатель, checkbox, чекбокс, selector, селектор, option, опция, filter, фильтр, multiple, несколько, меню","https://www.figma.com/file/7V4UQ61IVRxGArYZ20n7MH?node-id=114202%3A477954","App Components"
"Segmented Control 2","Segmented Control, сегментед контрол, segmented, сегментированный, control, контрол, tab, вкладка, selector, селектор, choice, выбор, option, опция, filter, фильтр, tabs, табы, radio, радио","https://www.figma.com/file/7V4UQ61IVRxGArYZ20n7MH?node-id=176609%3A10800","App Components"
"Textarea","инпут, textarea, текстовоеполе, input, ввод, text, текст, form, форма, multiline, многострочный, message, сообщение, comment, комментарий","https://www.figma.com/file/7V4UQ61IVRxGArYZ20n7MH?node-id=81211%3A301880","App Components"
"Form Chip","Form Chip, чип форма, chip, чип, form, форма, multiselect, множественныйвыбор, dropdown, выпадающийсписок, select, выбор, option, опция, filter, фильтр, tag, тег","https://www.figma.com/file/7V4UQ61IVRxGArYZ20n7MH?node-id=114202%3A484313","App Components"
"Choice Chip Multiselect","Choice Chip Multiselect, чип мультивыбор, чип мультиселект, chip, чип, multiselect, множественныйвыбор, toggle, переключатель, checkbox, чекбокс, selector, селектор, option, опция, filter, фильтр, multiple, несколько","https://www.figma.com/file/7V4UQ61IVRxGArYZ20n7MH?node-id=114202%3A478011","App Components"
"App Icon","App icon, апп икон, icon, иконка, app, приложение, mobile, мобильный, brand, бренд","https://www.figma.com/file/7V4UQ61IVRxGArYZ20n7MH?node-id=1324%3A240","App Components"
"Segmented Control Small 4","Segmented Control, сегментед контрол, segmented, сегментированный, control, контрол, toggle, переключатель, switch, переключение, tab, вкладка, selector, селектор, choice, выбор, option, опция, filter, фильтр, tabs, табы, radio, радио","https://www.figma.com/file/7V4UQ61IVRxGArYZ20n7MH?node-id=176609%3A11424","App Components"
"Tabs Stroke","Tabs Stroke, табс строк, tabs, вкладки, navigation, навигация, selector, селектор, line, линия, underline, подчеркивание, switch, переключение, group, группа","https://www.figma.com/file/7V4UQ61IVRxGArYZ20n7MH?node-id=5666%3A64301","App Components"
"Pagination Dots Clip Alternative","Pagination Dots Clip Alternative, пагинация альтернативная, пагинация чип, pagination, пагинация, dots, точки, indicator, индикатор, navigation, навигация, slider, слайдер, swipe, свайп","https://www.figma.com/file/7V4UQ61IVRxGArYZ20n7MH?node-id=250546%3A9040","App Components"
"Search Bar","Search Bar, серч бар, search, поиск, bar, строка, input, ввод, find, найти, query, запрос","https://www.figma.com/file/7V4UQ61IVRxGArYZ20n7MH?node-id=1324%3A1429","App Components"
"Tooltip Custom","указатель, tooltip, подсказка, hint, совет, help, помощь, info, информация, popup, всплывашка, guide, гайд, description, описание, tip, custom, кастомный","https://www.figma.com/file/7V4UQ61IVRxGArYZ20n7MH?node-id=250736%3A10849","App Components"
"Write Bar Panel","Write Bar Panel, бар панель, bar panel, writebar, панельввода, message, сообщение, input, ввод, text, текст, keyboard, клавиатура, state, состояние, focus, фокус, bottom, низ, panel, панель, chat, чат","https://www.figma.com/file/7V4UQ61IVRxGArYZ20n7MH?node-id=14332%3A1596","App Components"
"Stories View","Stories View, сторис вью, stories, сторис, carousel, карусель, fullscreen, полныйэкран, content, контент, immersion, погружение, block, блок, media, медиа, visual, визуал","https://www.figma.com/file/7V4UQ61IVRxGArYZ20n7MH?node-id=12248%3A1778","App Components"
"Dropdown","dropdown, выпадающийсписок, select, выбор, menu, меню, list, список, option, опция, filter, фильтр, form, форма","https://www.figma.com/file/7V4UQ61IVRxGArYZ20n7MH?node-id=80910%3A302039","App Components"
"Tooltip","tooltip, подсказка, hint, совет, help, помощь, info, информация, popup, всплывашка, guide, гайд, description, описание, tip, тултипы, указатель","https://www.figma.com/file/7V4UQ61IVRxGArYZ20n7MH?node-id=1923%3A126","App Components"
"Passcode New Code","Passcode New Code, пасс код, пин код, passcode, пароль, auth, аутентификация, security, безопасность, pin, пинкод, lock, блокировка, protection, защита, access, доступ, verification, проверка","https://www.figma.com/file/7V4UQ61IVRxGArYZ20n7MH?node-id=125563%3A4324","App Components"
"Segmented Control 3","Segmented Control, сегментед контрол, segmented, сегментированный, control, контрол, toggle, переключатель, switch, переключение, tab, вкладка, selector, селектор, choice, выбор, option, опция, filter, фильтр, tabs, табы, radio, радио","https://www.figma.com/file/7V4UQ61IVRxGArYZ20n7MH?node-id=176609%3A10837","App Components"
"Segmented Control 4","Segmented Control, сегментед контрол, segmented, сегментированный, control, контрол, toggle, переключатель, switch, переключение, tab, вкладка, selector, селектор, choice, выбор, option, опция, filter, фильтр, tabs, табы, radio, радио","https://www.figma.com/file/7V4UQ61IVRxGArYZ20n7MH?node-id=176609%3A10920","App Components"
"Slider Alternative","Slider Alternative, слайдер альтернативный, Range, рейндж, ползунок, slider, слайдер, adjust, регулировка","https://www.figma.com/file/7V4UQ61IVRxGArYZ20n7MH?node-id=171980%3A2352","App Components"
"Radio Button","Radio Button радио кнопка, radio, радио, button, кнопка, select, выбор, option, опция, choice, exclusive, исключающий, singleselect, одиночный выбор","https://www.figma.com/file/7V4UQ61IVRxGArYZ20n7MH?node-id=1462%3A35","App Components"
"Bulleted List","Bulleted List, буллет лист, булет, булеты, list, список, bullet, маркер, unordered, немаркированный, items, пункт","https://www.figma.com/file/7V4UQ61IVRxGArYZ20n7MH?node-id=45565%3A421999","App Components"
"Choice Chip Multiselect Menu w Graphic","Choice Chip Multiselect Menu w Graphic, чип мультивыбор, чип мультиселект, chip, чип, multiselect, множественныйвыбор, toggle, переключатель, checkbox, чекбокс, selector, селектор, option, опция, filter, фильтр, multiple, несколько, меню","https://www.figma.com/file/7V4UQ61IVRxGArYZ20n7MH?node-id=197223%3A9731","App Components"
